<?xml version="1.0"?>
<!DOCTYPE videocd PUBLIC "-//GNU//DTD VideoCD//EN" "http://www.gnu.org/software/vcdimager/videocd.dtd">

<!-- used by check_vcd11.sh script -->

<videocd xmlns="http://www.gnu.org/software/vcdimager/1.0/" class="vcd" version="1.1">
  <info>
    <album-id>CHECK</album-id>
    <volume-count>1</volume-count>
    <volume-number>4</volume-number>
    <restriction>1</restriction>
  </info>
  <pvd>
    <volume-id>VIDEOCD</volume-id>
    <system-id>CD-RTOS CD-BRIDGE</system-id>
    <application-id>VIDEOCD.APP;1</application-id>
    <preparer-id>PREP_ID</preparer-id>
    <publisher-id>PUBL_ID</publisher-id>
  </pvd>

  <sequence-items>
    <sequence-item src="avseq00.m1p" id="sequence-00"/>
    <sequence-item src="avseq00.m1p" id="sequence-01"/>
    <sequence-item src="avseq00.m1p" id="sequence-02"/>
    <sequence-item src="avseq00.m1p" id="sequence-03"/>
  </sequence-items>

</videocd>
