<?xml version="1.0"?>
<!DOCTYPE videocd PUBLIC "-//GNU//DTD VideoCD//EN" "http://www.gnu.org/software/vcdimager/videocd.dtd">

<!-- used by check_vcd20.sh script -->

<videocd xmlns="http://www.gnu.org/software/vcdimager/1.0/" class="vcd" version="2.0">
  <info>
    <album-id>CHECK</album-id>
    <volume-count>1</volume-count>
    <volume-number>4</volume-number>
    <restriction>1</restriction>
  </info>
  <pvd>
    <volume-id>VIDEOCD</volume-id>
    <system-id>CD-RTOS CD-BRIDGE</system-id>
    <application-id>VIDEOCD.APP;1</application-id>
    <preparer-id>PREP_ID</preparer-id>
    <publisher-id>PUBL_ID</publisher-id>
  </pvd>

  <segment-items>
    <segment-item src="item0000.m1p" id="segment-0000"/>
    <segment-item src="item0000.m1p" id="segment-0001"/>
    <segment-item src="item0000.m1p" id="segment-0002"/>
  </segment-items>

  <sequence-items>
    <sequence-item src="avseq00.m1p" id="sequence-00">
      <default-entry id="entry-001"/>
    </sequence-item>
    <sequence-item src="avseq00.m1p" id="sequence-01"/>
    <sequence-item src="avseq00.m1p" id="sequence-02"/>
    <sequence-item src="avseq00.m1p" id="sequence-03">
      <entry id="entry-002">0.000000</entry>
    </sequence-item>
  </sequence-items>

  <pbc>
    <selection id="menu">
      <bsn>1</bsn>
      <next ref="lid-end"/>
      <return ref="lid-end" x1="10" y1="20" x2="30" y2="40"/>
      <wait>-1</wait>
      <loop jump-timing="immediate">1</loop>
      <play-item ref="segment-0000"/>
      <select ref="lid-000" />
      <select ref="lid-001" />
      <select ref="lid-end" />
    </selection>

    <playlist id="lid-000">
      <next ref="lid-001"/>
      <return ref="lid-end"/>
      <wait>5</wait>
      <autowait>0</autowait>
      <play-item ref="sequence-00"/>
      <play-item ref="sequence-01"/>
      <play-item ref="segment-0001"/>
      <play-item ref="entry-001"/>
    </playlist>

    <playlist id="lid-001">
      <next ref="lid-end"/>
      <return ref="lid-end"/>
      <wait>5</wait>
      <autowait>0</autowait>
      <play-item ref="sequence-02"/>
      <play-item ref="sequence-03"/>
      <play-item ref="segment-0002"/>
      <play-item ref="entry-002"/>
    </playlist>

    <endlist id="lid-end" rejected="true"/>
  </pbc>
</videocd>
